{
  "project_id": "project-001",
  "milestone_id": "milestone-001",
  "acceptance_criteria": [
    "API requests must support retries",
    "API requests must be idempotent"
  ],
  "feedback": [
    {
      "id": "feedback-001",
      "author": "backer-001",
      "content": "Please focus the next iteration on API architecture, retries, and idempotency."
    }
  ],
  "evidence": [
    {
      "id": "commit-abc123",
      "type": "github_commit",
      "locator": "https://github.com/example/project/commit/abc123",
      "summary": "Adds API endpoints and improves the dashboard UI, but does not mention retries or idempotency.",
      "content_hash": "sha256:example-abc123"
    }
  ]
}
